metric_name,metric_display,metric_kind,metric_type,metric_ unit,metric_resource,metric_description
gcp.tpu.container.cpu.utilization,Container CPU utilization,GAUGE,DOUBLE,%,tpu_worker,"Current CPU utilization of the docker container on the TPU worker. Sampled every 60 seconds. After sampling, data is not visible for up to 60 seconds."
gcp.tpu.container.memory.usage,Container memory usage,GAUGE,DOUBLE,By,tpu_worker,"Current memory usage of the docker container on the TPU worker. Sampled every 60 seconds. After sampling, data is not visible for up to 60 seconds."
gcp.tpu.cpu.utilization,CPU utilization,GAUGE,DOUBLE,%,tpu_worker,"Current CPU utilization on the TPU worker, represented as a percentage. Values are typically numbers between 0.0 and 100.0, but might exceed 100.0. Sampled every 60 seconds. After sampling, data is not visible for up to 180 seconds."
gcp.tpu.memory.usage,Memory usage,GAUGE,INT64,By,tpu_worker,"Memory usage in bytes. Sampled every 60 seconds. After sampling, data is not visible for up to 180 seconds."
gcp.tpu.network.received_bytes_count,Network bytes received,DELTA,INT64,By,tpu_worker,"Cumulative bytes of data this server has received over the network. Sampled every 60 seconds. After sampling, data is not visible for up to 180 seconds."
gcp.tpu.network.sent_bytes_count,Network bytes sent,DELTA,INT64,By,tpu_worker,"Cumulative bytes of data this server has sent over the network. Sampled every 60 seconds. After sampling, data is not visible for up to 180 seconds."
gcp.tpu.tpu.mxu.utilization,MXU utilization,GAUGE,DOUBLE,%,tpu_worker,"Current MXU utilization on the TPU worker, represented as a percentage. Values are typically numbers between 0.0 and 100.0. Sampled every 60 seconds. After sampling, data is not visible for up to 180 seconds."
